{
  "schemaVersion": "capability-corpus/v1",
  "catalogRole": "regression_only",
  "runtimeDecisionUse": "forbidden",
  "samples": [
    {
      "id": "sample.column-pilot.paper1",
      "displayName": "Column pilot paper1",
      "source": {
        "fileName": "论文样本1.pdf",
        "mediaType": "application/pdf",
        "sha256": "7ba73a901c7bacf14cdff7d9e16480cc451ca3a521977795a3de9c4e67bba0ac",
        "bytes": 2284562,
        "pageCount": 6
      },
      "provenance": {
        "kind": "user_provided",
        "reference": "Existing user-provided PDF sample; EVD-20260916-COLUMN-PILOT-CURRENT-CAPTURE"
      },
      "rights": {
        "status": "metadata_only",
        "canStoreMetadata": true,
        "canStoreBinary": false
      },
      "boundaryFeatureIds": [
        "boundary.column.single",
        "boundary.column.double",
        "boundary.column.mixed-full-width",
        "boundary.column.page-transition"
      ],
      "expectedOutcomes": [
        {
          "capabilityId": "cap.column-recognition",
          "assertionId": "assert.column.page-region-truth",
          "oracleType": "exact",
          "expected": {
            "pageLayoutBasis": "body_text_flow_only",
            "pages": [
              {
                "pageNumber": 1,
                "layout": "double_column"
              },
              {
                "pageNumber": 2,
                "layout": "double_column"
              },
              {
                "pageNumber": 3,
                "layout": "double_column"
              },
              {
                "pageNumber": 4,
                "layout": "double_column"
              },
              {
                "pageNumber": 5,
                "layout": "double_column"
              },
              {
                "pageNumber": 6,
                "layout": "double_column"
              }
            ],
            "independentRegions": [
              {
                "pageNumber": 1,
                "type": "title"
              },
              {
                "pageNumber": 1,
                "type": "abstract"
              },
              {
                "pageNumber": 1,
                "type": "other_independent"
              },
              {
                "pageNumber": 3,
                "type": "figure"
              },
              {
                "pageNumber": 3,
                "type": "figure_caption"
              },
              {
                "pageNumber": 5,
                "type": "references_section_header"
              }
            ]
          },
          "notes": "Independent-region vocabulary is closed for this pilot; no subtype inference is authorized."
        }
      ],
      "evidenceRefs": [
        "EVD-20260916-COLUMN-PILOT-CURRENT-CAPTURE",
        "EVD-20260916-COLUMN-PILOT-TEXT-FLOW-REVIEW",
        "EVD-20260916-COLUMN-PILOT-INDEPENDENT-REGION-REVIEW"
      ],
      "storage": {
        "binaryCommitted": false,
        "externalSourceRequiredForRun": true
      },
      "authorityBoundary": {
        "catalogRole": "regression_oracle",
        "runtimeDecisionUse": "forbidden",
        "finalDecisionsOwnedBy": [
          "AA-COLUMN-001"
        ]
      }
    },
    {
      "id": "sample.column-pilot.paper2",
      "displayName": "Column pilot paper2",
      "source": {
        "fileName": "论文样本2.pdf",
        "mediaType": "application/pdf",
        "sha256": "a3caa00f90f1b68a2068bbed07b2b91b6b40b3f65d1c3b22302e21333510e36f",
        "bytes": 283040,
        "pageCount": 11
      },
      "provenance": {
        "kind": "user_provided",
        "reference": "Existing user-provided PDF sample; EVD-20260916-COLUMN-PILOT-CURRENT-CAPTURE"
      },
      "rights": {
        "status": "metadata_only",
        "canStoreMetadata": true,
        "canStoreBinary": false
      },
      "boundaryFeatureIds": [
        "boundary.column.single",
        "boundary.column.double",
        "boundary.column.mixed-full-width",
        "boundary.column.page-transition"
      ],
      "expectedOutcomes": [
        {
          "capabilityId": "cap.column-recognition",
          "assertionId": "assert.column.page-region-truth",
          "oracleType": "exact",
          "expected": {
            "pageLayoutBasis": "body_text_flow_only",
            "pages": [
              {
                "pageNumber": 1,
                "layout": "double_column"
              },
              {
                "pageNumber": 2,
                "layout": "double_column"
              },
              {
                "pageNumber": 3,
                "layout": "double_column"
              },
              {
                "pageNumber": 4,
                "layout": "double_column"
              },
              {
                "pageNumber": 5,
                "layout": "double_column"
              },
              {
                "pageNumber": 6,
                "layout": "double_column"
              },
              {
                "pageNumber": 7,
                "layout": "double_column"
              },
              {
                "pageNumber": 8,
                "layout": "double_column"
              },
              {
                "pageNumber": 9,
                "layout": "double_column"
              },
              {
                "pageNumber": 10,
                "layout": "double_column"
              },
              {
                "pageNumber": 11,
                "layout": "double_column"
              }
            ],
            "independentRegions": [
              {
                "pageNumber": 1,
                "type": "title"
              },
              {
                "pageNumber": 1,
                "type": "abstract"
              },
              {
                "pageNumber": 1,
                "type": "other_independent"
              }
            ]
          },
          "notes": "Independent-region vocabulary is closed for this pilot; no subtype inference is authorized."
        }
      ],
      "evidenceRefs": [
        "EVD-20260916-COLUMN-PILOT-CURRENT-CAPTURE",
        "EVD-20260916-COLUMN-PILOT-TEXT-FLOW-REVIEW",
        "EVD-20260916-COLUMN-PILOT-INDEPENDENT-REGION-REVIEW"
      ],
      "storage": {
        "binaryCommitted": false,
        "externalSourceRequiredForRun": true
      },
      "authorityBoundary": {
        "catalogRole": "regression_oracle",
        "runtimeDecisionUse": "forbidden",
        "finalDecisionsOwnedBy": [
          "AA-COLUMN-001"
        ]
      }
    },
    {
      "id": "sample.column-pilot.paper3",
      "displayName": "Column pilot paper3",
      "source": {
        "fileName": "论文样本3.pdf",
        "mediaType": "application/pdf",
        "sha256": "fa33485f517b3c94d2f6e4d4366f3ab14a1e413a738db512e1862f4a0944f5f9",
        "bytes": 505955,
        "pageCount": 14
      },
      "provenance": {
        "kind": "user_provided",
        "reference": "Existing user-provided PDF sample; EVD-20260916-COLUMN-PILOT-CURRENT-CAPTURE"
      },
      "rights": {
        "status": "metadata_only",
        "canStoreMetadata": true,
        "canStoreBinary": false
      },
      "boundaryFeatureIds": [
        "boundary.column.single",
        "boundary.column.double",
        "boundary.column.mixed-full-width",
        "boundary.column.page-transition"
      ],
      "expectedOutcomes": [
        {
          "capabilityId": "cap.column-recognition",
          "assertionId": "assert.column.page-region-truth",
          "oracleType": "exact",
          "expected": {
            "pageLayoutBasis": "body_text_flow_only",
            "pages": [
              {
                "pageNumber": 1,
                "layout": "single_column"
              },
              {
                "pageNumber": 2,
                "layout": "single_column"
              },
              {
                "pageNumber": 3,
                "layout": "single_column"
              },
              {
                "pageNumber": 4,
                "layout": "single_column"
              },
              {
                "pageNumber": 5,
                "layout": "single_column"
              },
              {
                "pageNumber": 6,
                "layout": "single_column"
              },
              {
                "pageNumber": 7,
                "layout": "single_column"
              },
              {
                "pageNumber": 8,
                "layout": "single_column"
              },
              {
                "pageNumber": 9,
                "layout": "single_column"
              },
              {
                "pageNumber": 10,
                "layout": "single_column"
              },
              {
                "pageNumber": 11,
                "layout": "single_column"
              },
              {
                "pageNumber": 12,
                "layout": "single_column"
              },
              {
                "pageNumber": 13,
                "layout": "single_column"
              },
              {
                "pageNumber": 14,
                "layout": "single_column"
              }
            ],
            "independentRegions": [
              {
                "pageNumber": 1,
                "type": "title"
              },
              {
                "pageNumber": 1,
                "type": "abstract"
              },
              {
                "pageNumber": 1,
                "type": "other_independent"
              }
            ]
          },
          "notes": "Independent-region vocabulary is closed for this pilot; no subtype inference is authorized."
        }
      ],
      "evidenceRefs": [
        "EVD-20260916-COLUMN-PILOT-CURRENT-CAPTURE",
        "EVD-20260916-COLUMN-PILOT-TEXT-FLOW-REVIEW",
        "EVD-20260916-COLUMN-PILOT-INDEPENDENT-REGION-REVIEW"
      ],
      "storage": {
        "binaryCommitted": false,
        "externalSourceRequiredForRun": true
      },